passport,en,What documents are required to apply for a passport?,"You need a completed application form, national ID or birth certificate, recent passport-size photos, and proof of payment. (DEMO)"
passport,en,Where can I apply for a passport?,"You can apply at the main immigration office or designated regional passport offices. (DEMO)"
passport,en,How much does a passport cost?,"The passport fee depends on the type and processing speed. Please check the official fee schedule. (DEMO)"
passport,en,How long does it take to get a passport?,"Normal processing takes several weeks, while expedited services are faster. (DEMO)"
passport,en,Can I apply for a passport online?,"Some steps may be completed online, but physical presence is required for biometrics. (DEMO)"
passport,en,What is the validity period of a passport?,"Passports are usually valid for 5 or 10 years depending on applicant category. (DEMO)"
passport,en,How do I renew an expired passport?,"You must submit the old passport, renewal form, photos, and pay the renewal fee. (DEMO)"
passport,en,Can I renew my passport before it expires?,"Yes, early renewal is allowed within a specified period before expiry. (DEMO)"
passport,en,What should I do if my passport is lost?,"Report the loss immediately and apply for a replacement with a police report. (DEMO)"
passport,en,What should I do if my passport is damaged?,"Submit the damaged passport with an explanation letter and apply for replacement. (DEMO)"
passport,en,Can children apply for passports?,"Yes, minors can apply with parental consent and guardian documents. (DEMO)"
passport,en,What documents are required for a child passport?,"Birth certificate, parent IDs, consent letter, and photos are required. (DEMO)"
passport,en,Do both parents need to be present for a child passport?,"Usually yes, unless legal documents state otherwise. (DEMO)"
passport,en,Can a guardian apply on behalf of a minor?,"Yes, with valid guardianship documents. (DEMO)"
passport,en,What is biometric enrollment?,"It includes capturing fingerprints, photo, and signature at the passport office. (DEMO)"
passport,en,Is biometric data mandatory?,"Yes, biometric data is required for passport issuance. (DEMO)"
passport,en,Can elderly applicants skip biometrics?,"Certain exemptions may apply based on age or health conditions. (DEMO)"
passport,en,What type of photos are required for passport application?,"Recent passport-size photos with a white background are required. (DEMO)"
passport,en,Can I smile in my passport photo?,"No, a neutral facial expression is required. (DEMO)"
passport,en,What happens if my application is rejected?,"You will be informed of the reason and advised on corrective steps. (DEMO)"
passport,en,Can I track my passport application status?,"Yes, you can track status using the reference number provided. (DEMO)"
passport,en,What is an expedited passport service?,"It is a faster processing option available for additional fees. (DEMO)"
passport,en,Who is eligible for expedited passport processing?,"Applicants with urgent travel needs may qualify. (DEMO)"
passport,en,Can I change my name on my passport?,"Yes, with legal proof such as a court order or marriage certificate. (DEMO)"
passport,en,How do I correct errors on my passport?,"Apply for correction with supporting documents showing the error. (DEMO)"
passport,en,Is passport replacement free if the error is not mine?,"Corrections due to official error may be free of charge. (DEMO)"
passport,en,Can I travel if my passport is about to expire?,"Most countries require at least six months validity. (DEMO)"
passport,en,What should I do if my passport expires abroad?,"Contact the nearest embassy or consulate for assistance. (DEMO)"
passport,en,Can I hold two passports?,"Dual passports are only allowed under specific legal conditions. (DEMO)"
passport,en,What is a machine-readable passport?,"It is a passport with encoded data readable by scanners. (DEMO)"
passport,en,What is an e-passport?,"An electronic passport contains a biometric chip for security. (DEMO)"
passport,en,Is an e-passport mandatory?,"E-passports are becoming standard but availability may vary. (DEMO)"
passport,en,Can I apply for a passport while abroad?,"Yes, through embassies or consulates. (DEMO)"
passport,en,How long does overseas passport processing take?,"It may take longer than domestic processing. (DEMO)"
passport,en,What payment methods are accepted for passport fees?,"Payments can be made via bank deposit or approved payment channels. (DEMO)"
passport,en,Is the passport fee refundable?,"Passport fees are generally non-refundable. (DEMO)"
passport,en,What is a temporary travel document?,"It is issued for emergency travel when a passport is unavailable. (DEMO)"
passport,en,Who can get a temporary travel document?,"Citizens with urgent travel needs may qualify. (DEMO)"
passport,en,Can I update my address on my passport?,"Address updates usually do not require passport reissue. (DEMO)"
passport,en,Does passport issuance require an appointment?,"Appointments may be required depending on office capacity. (DEMO)"
passport,en,How do I book a passport appointment?,"Appointments can be booked online or at the service office. (DEMO)"
passport,en,What should I bring on my appointment day?,"Original documents, copies, photos, and payment receipt. (DEMO)"
passport,en,Can someone else collect my passport for me?,"Collection by proxy may be allowed with authorization. (DEMO)"
passport,en,How will I be notified when my passport is ready?,"You may receive SMS or email notification. (DEMO)"
passport,en,What if I miss my passport appointment?,"You may need to reschedule or rebook a new appointment. (DEMO)"
passport,en,Can pregnant women get priority service?,"Priority may be given based on medical need. (DEMO)"
passport,en,Are persons with disabilities given special support?,"Yes, assistance and priority service may be provided. (DEMO)"
passport,en,What languages are supported in passport services?,"Services are usually provided in major national languages. (DEMO)"
passport,en,Can refugees apply for national passports?,"Refugees must follow specific legal procedures. (DEMO)"
passport,en,What is a diplomatic passport?,"It is issued to government officials for official travel. (DEMO)"
passport,en,What is a service passport?,"It is issued for official government duties abroad. (DEMO)"
passport,en,Who qualifies for a diplomatic passport?,"High-level officials and diplomats qualify. (DEMO)"
passport,en,Can ordinary citizens apply for diplomatic passports?,"No, eligibility is restricted by law. (DEMO)"
passport,en,How many blank pages should a passport have?,"At least two blank pages are recommended for travel. (DEMO)"
passport,en,Can I add extra pages to my passport?,"Extra pages are not added; renewal is required. (DEMO)"
passport,en,What happens to my old passport after renewal?,"It may be returned with cancellation marks. (DEMO)"
passport,en,Can I keep my old passport after renewal?,"Yes, but it will be invalid for travel. (DEMO)"
passport,en,What is the passport application reference number?,"It is a unique number used to track your application. (DEMO)"
passport,en,Is fingerprint data stored securely?,"Yes, biometric data is stored under strict security rules. (DEMO)"
passport,en,Can my passport be revoked?,"Yes, under certain legal circumstances. (DEMO)"
passport,en,What laws govern passport issuance?,"Passport services are governed by national immigration laws. (DEMO)"
passport,en,Where can I get official passport information?,"From the official immigration authority website or offices. (DEMO)"
passport,en,Who should I contact for passport complaints?,"Contact the customer service desk or complaint office. (DEMO)"
passport,en,Can I apply for a passport with an expired ID?,"Valid identification is required for application. (DEMO)"
passport,en,Is an interview required for passport application?,"Some applicants may be required to attend an interview. (DEMO)"
passport,en,What security checks are done before issuing a passport?,"Identity verification and background checks are performed. (DEMO)"
passport,en,Can I update my marital status on my passport?,"Marital status changes require legal proof. (DEMO)"
passport,en,What should I do if my passport is stolen abroad?,"Report to local police and contact your embassy immediately. (DEMO)"
passport,en,Can I apply for a passport if I owe legal fines?,"Outstanding legal issues may affect eligibility. (DEMO)"
passport,en,How early should I apply before traveling?,"Apply several months before your planned travel date. (DEMO)"
